{
  "schemaVersion": 1,
  "assetId": "fe68d358-b23e-47e3-8b0c-898f5205f9f3",
  "assetFile": "Arc chair.glb",
  "status": "needs_changes",
  "updatedAt": "2026-09-08T21:35:29.560Z",
  "comments": [
    {
      "id": "fefd0cb0-6174-40f5-80a6-c9fec4d14751",
      "text": "Soften the front edge of the seat. Keep the profile light.",
      "createdAt": "2026-09-08T21:35:29.559Z",
      "updatedAt": "2026-09-08T21:35:29.559Z"
    }
  ]
}
